{
  "schema_version": 1,
  "run_id": "design-doc-tdd-2026-04-25-1437-a7c3",
  "workflow": "design-doc-tdd",
  "phase": "review",
  "severity": "high",
  "opened_at": "2026-04-25T14:37:48Z",
  "timeout_at": null,
  "artefact": {
    "path": "runs/design-doc-tdd-2026-04-25-1437-a7c3/review.md",
    "kind": "markdown",
    "preview_lines": 200
  },
  "context": {
    "preceded_by": ["design"],
    "next_phase": "implement",
    "prompt_summary": "3 reviewers fanned out, judge merged."
  },
  "decision_options": ["approve", "reject"]
}
